{
 "answer": "Nasjonal informasjon: - Kontaktvei: eleven/foresatte kan kontakte skolen (kontaktlarer) som tar kontakt med PPT; direktekontakt med PPT er ogsa mulig. Ved individrettet bistand skal eleven alltid signere henvisningsskjema.\n\nNasjonal informasjon: - **Henvisning**: Det er vanligvis barnehagen eller skolen som sender henvisning til PPT; kommunen sender henvisningen i samarbeid med foreldrene. Foreldrene/elever over 15 maa samtykke til henvisning og til den sakkyndige vurderingen. Hver kommune kan ha egne rutiner for henvisningsvei. [Kategori: nasjonal veileder + lokal praksis]\n\nNasjonal informasjon: | Kommunepsykolog/kommunalt lavterskeltilbud | Kartlegging, korttidsbehandling, veiledning til foreldre | Direkte kontakt uten henvisning i mange kommuner | Varierer: navn, alder, innhold; sjekk lokal kommune |\n\nNasjonal informasjon: 3. **Medisinsk/psykiatrisk utredning**: fastlege utelukker somatiske faktorer (soevn, hoersel/syn) og henviser til BUP; BUP stiller eventuell diagnose og vurderer behandling. Henvisningskompetanse til BUP ligger hos fastlege, psykolog i kommunen og barnevernsleder (fil 25) - ikke hos PPT direkte.\n\nNasjonal informasjon: **Funn**: Helsedirektoratets veileder \"Psykisk helsearbeid barn og unge\" navngir formal henvisningsrett til psykisk helsevern for barn og unge: \"Fastleger, psykologer og barnevernsledere har henvisningsrett\". Skolehelsetjenesten og helsestasjon for ungdom er ikke nevnt i henvisningsretten. Skolehelsetjenestens rolle er a stotte eleven og hjelpe til a kontakte fastlege eller kommunalt tilbud.\n\nFant ingen registrerte kommunale tilbud for denne henvendelsen. Det betyr ikke at tilbudet ikke finnes; det kan bety at oppslaget ikke dekker kommunen eller at soeket ikke ga treff.\n\nKilde P-K001: 24-kildedokumentasjon-bup-og-habu.md (verifisert 2026-09-09)\nKilde P-K002: 28-ppt-i-dybden.md (verifisert 2026-09-09)\nKilde P-K003: 26-beslutningsstotte-hvor-henvende-seg.md (verifisert 2026-09-09)\nKilde P-K004: 32-cases-og-dokumentasjonskjede-skole.md (verifisert 2026-09-09)\nKilde P-K005: 28c-beslutningsstotte-gaps.md (verifisert 2026-09-09)",
 "claims": [
  "- Kontaktvei: eleven/foresatte kan kontakte skolen (kontaktlarer) som tar kontakt med PPT; direktekontakt med PPT er ogsa mulig. Ved individrettet bistand skal eleven alltid signere henvisningsskjema.",
  "- **Henvisning**: Det er vanligvis barnehagen eller skolen som sender henvisning til PPT; kommunen sender henvisningen i samarbeid med foreldrene. Foreldrene/elever over 15 må samtykke til henvisning og til den sakkyndige vurderingen. Hver kommune kan ha egne rutiner for henvisningsvei. [Kategori: nasjonal veileder + lokal praksis]",
  "| Kommunepsykolog/kommunalt lavterskeltilbud | Kartlegging, korttidsbehandling, veiledning til foreldre | Direkte kontakt uten henvisning i mange kommuner | Varierer: navn, alder, innhold; sjekk lokal kommune |",
  "3. **Medisinsk/psykiatrisk utredning**: fastlege utelukker somatiske faktorer (søvn, hørsel/syn) og henviser til BUP; BUP stiller eventuell diagnose og vurderer behandling. Henvisningskompetanse til BUP ligger hos fastlege, psykolog i kommunen og barnevernsleder (fil 25) - ikke hos PPT direkte.",
  "**Funn**: Helsedirektoratets veileder \"Psykisk helsearbeid barn og unge\" navngir formal henvisningsrett til psykisk helsevern for barn og unge: \"Fastleger, psykologer og barnevernsledere har henvisningsrett\". Skolehelsetjenesten og helsestasjon for ungdom er ikke nevnt i henvisningsretten. Skolehelsetjenestens rolle er a stotte eleven og hjelpe til a kontakte fastlege eller kommunalt tilbud."
 ],
 "epistemic_state": "EXISTENCE_ONLY",
 "evidence": {
  "conflicts": [],
  "per_track_epistemic": {
   "T1": "EXISTENCE_ONLY"
  }
 },
 "execution_status": "SUCCESS",
 "failures": [
  {
   "message": "local discovery not applicable: no municipality in location_context",
   "stage": "local_discovery",
   "state": "RECOVERABLE"
  }
 ],
 "no_route_asserted": true,
 "presented_as_complete": true,
 "provenance": [
  {
   "authority_level": "INTERNAL_DOC",
   "chain_parent_id": null,
   "claim_supported": "- Kontaktvei: eleven/foresatte kan kontakte skolen (kontaktlarer) som tar kontakt med PPT; direktekontakt med PPT er ogsa mulig. Ved individrettet bistand skal eleven alltid signere henvisningsskjema.",
   "conflicts_with": [],
   "evidence_span": "- Kontaktvei: eleven/foresatte kan kontakte skolen (kontaktlarer) som tar kontakt med PPT; direktekontakt med PPT er ogsa mulig. Ved individrettet bistand skal eleven alltid signere henvisningsskjema.",
   "freshness_class": "POINT_IN_TIME",
   "id": "P-K001",
   "retrieved_at": null,
   "source_ref": "24-kildedokumentasjon-bup-og-habu.md",
   "source_type": "PROJECT_RESEARCH",
   "verified_at": "2026-09-09"
  },
  {
   "authority_level": "INTERNAL_DOC",
   "chain_parent_id": null,
   "claim_supported": "- **Henvisning**: Det er vanligvis barnehagen eller skolen som sender henvisning til PPT; kommunen sender henvisningen i samarbeid med foreldrene. Foreldrene/elever over 15 må samtykke til henvisning ",
   "conflicts_with": [],
   "evidence_span": "- **Henvisning**: Det er vanligvis barnehagen eller skolen som sender henvisning til PPT; kommunen sender henvisningen i samarbeid med foreldrene. Foreldrene/elever over 15 må samtykke til henvisning ",
   "freshness_class": "POINT_IN_TIME",
   "id": "P-K002",
   "retrieved_at": null,
   "source_ref": "28-ppt-i-dybden.md",
   "source_type": "PROJECT_RESEARCH",
   "verified_at": "2026-09-09"
  },
  {
   "authority_level": "INTERNAL_DOC",
   "chain_parent_id": null,
   "claim_supported": "| Kommunepsykolog/kommunalt lavterskeltilbud | Kartlegging, korttidsbehandling, veiledning til foreldre | Direkte kontakt uten henvisning i mange kommuner | Varierer: navn, alder, innhold; sjekk lokal",
   "conflicts_with": [],
   "evidence_span": "| Kommunepsykolog/kommunalt lavterskeltilbud | Kartlegging, korttidsbehandling, veiledning til foreldre | Direkte kontakt uten henvisning i mange kommuner | Varierer: navn, alder, innhold; sjekk lokal",
   "freshness_class": "CURRENT",
   "id": "P-K003",
   "retrieved_at": null,
   "source_ref": "26-beslutningsstotte-hvor-henvende-seg.md",
   "source_type": "PROJECT_RESEARCH",
   "verified_at": "2026-09-09"
  },
  {
   "authority_level": "INTERNAL_DOC",
   "chain_parent_id": null,
   "claim_supported": "3. **Medisinsk/psykiatrisk utredning**: fastlege utelukker somatiske faktorer (søvn, hørsel/syn) og henviser til BUP; BUP stiller eventuell diagnose og vurderer behandling. Henvisningskompetanse til B",
   "conflicts_with": [],
   "evidence_span": "3. **Medisinsk/psykiatrisk utredning**: fastlege utelukker somatiske faktorer (søvn, hørsel/syn) og henviser til BUP; BUP stiller eventuell diagnose og vurderer behandling. Henvisningskompetanse til B",
   "freshness_class": "POINT_IN_TIME",
   "id": "P-K004",
   "retrieved_at": null,
   "source_ref": "32-cases-og-dokumentasjonskjede-skole.md",
   "source_type": "PROJECT_RESEARCH",
   "verified_at": "2026-09-09"
  },
  {
   "authority_level": "INTERNAL_DOC",
   "chain_parent_id": null,
   "claim_supported": "**Funn**: Helsedirektoratets veileder \"Psykisk helsearbeid barn og unge\" navngir formal henvisningsrett til psykisk helsevern for barn og unge: \"Fastleger, psykologer og barnevernsledere har henvisnin",
   "conflicts_with": [],
   "evidence_span": "**Funn**: Helsedirektoratets veileder \"Psykisk helsearbeid barn og unge\" navngir formal henvisningsrett til psykisk helsevern for barn og unge: \"Fastleger, psykologer og barnevernsledere har henvisnin",
   "freshness_class": "CURRENT",
   "id": "P-K005",
   "retrieved_at": null,
   "source_ref": "28c-beslutningsstotte-gaps.md",
   "source_type": "GAP",
   "verified_at": "2026-09-09"
  }
 ],
 "routes": [],
 "safety": {
  "priority": "NOT_ACUTE",
  "signals": [],
  "suppressed_routing": false
 },
 "safety_priority": "NOT_ACUTE",
 "tracks": [
  {
   "domain": "education",
   "status": "RESOLVED",
   "track_id": "T1"
  }
 ],
 "uncertainty_expressed": [
  "no_route_found",
  "top_state_EXISTENCE_ONLY"
 ]
}