{
 "answer": "Nasjonal informasjon: 65 virkedagers maksimumsfrist for oppstart: MAKSIMUMSFRIST for naar nodvendig spesialisthelsetjeneste senest skal vaere paabegynt; den individuelle faglig forsvarlige fristen kan vaere kortere\n\nNasjonal informasjon: 10 virkedagers vurderingsfrist: frist for beslutning om pasienten har rett til nodvendig helsehjelp fra spesialisthelsetjenesten, og om eventual tidspunkt for tilbudet\n\nNasjonal informasjon: | BUP/PHBU | Nei som hovedregel (0-18 aar). Ordinaer overgang ved 18 aar gaar til spesialisthelsetjenesten for voksne. Et pabegynt PHBU/BUP-forloep KAN etter konkret/individuell vurdering viderefoeres frem til fylte 23 aar - dette er ikke en automatisk rett til aa forbli i BUP/PHBU | [24-kildedokumentasjon-bup-og-habu](24-kildedokumentasjon-bup-og-habu.md) |\n\nNasjonal informasjon: - BUP BUK (Kvinne-barn-senteret): internt tilbud for innlagte og polikliniske barn 0-18 ar ved St. Olav; mottar kun henvisninger fra leger ved St. Olav; delansvar i lavterskeltilbudet for vold- og overgrep-utsatte barn.\n\nNasjonal informasjon: **Funn**: Beslutningsmatrisen i fil 26 dekker barn og unge 0-18 via BUP-ruten, men gir ikke en rad for unge 18-20 ar: over BUPs aldersgrense, innenfor HFUs (opptil 20 ar) og RPHs (over 16 ar) omfang, og fortsatt under 65-virkedagersfristen (under 23 ar) via spesialisthelsetjenesten for voksne.\n\nFant ingen registrerte kommunale tilbud for denne henvendelsen. Det betyr ikke at tilbudet ikke finnes; det kan bety at oppslaget ikke dekker kommunen eller at soeket ikke ga treff.\n\nKilde P-K001: https://lovdata.no/dokument/SF/forskrift/2000-12-01-1208 (verifisert 2026-09-09)\nKilde P-K002: https://lovdata.no/dokument/NL/lov/1999-07-02-63 (verifisert 2026-09-09)\nKilde P-K003: 28b-18-20-aar-routing.md (verifisert 2026-09-09)\nKilde P-K004: 24-kildedokumentasjon-bup-og-habu.md (verifisert 2026-09-09)\nKilde P-K005: 28c-beslutningsstotte-gaps.md (verifisert 2026-09-09)",
 "claims": [
  "65 virkedagers maksimumsfrist for oppstart: MAKSIMUMSFRIST for naar nodvendig spesialisthelsetjeneste senest skal vaere paabegynt; den individuelle faglig forsvarlige fristen kan vaere kortere",
  "10 virkedagers vurderingsfrist: frist for beslutning om pasienten har rett til nodvendig helsehjelp fra spesialisthelsetjenesten, og om eventual tidspunkt for tilbudet",
  "| BUP/PHBU | Nei som hovedregel (0-18 år). Ordinær overgang ved 18 år går til spesialisthelsetjenesten for voksne. Et pabegynt PHBU/BUP-forløp KAN etter konkret/individuell vurdering videreføres frem til fylte 23 år - dette er ikke en automatisk rett til å forbli i BUP/PHBU | [24-kildedokumentasjon-bup-og-habu](24-kildedokumentasjon-bup-og-habu.md) |",
  "- BUP BUK (Kvinne-barn-senteret): internt tilbud for innlagte og polikliniske barn 0-18 ar ved St. Olav; mottar kun henvisninger fra leger ved St. Olav; delansvar i lavterskeltilbudet for vold- og overgrep-utsatte barn.",
  "**Funn**: Beslutningsmatrisen i fil 26 dekker barn og unge 0-18 via BUP-ruten, men gir ikke en rad for unge 18-20 ar: over BUPs aldersgrense, innenfor HFUs (opptil 20 ar) og RPHs (over 16 ar) omfang, og fortsatt under 65-virkedagersfristen (under 23 ar) via spesialisthelsetjenesten for voksne."
 ],
 "epistemic_state": "EXISTENCE_ONLY",
 "evidence": {
  "conflicts": [],
  "per_track_epistemic": {
   "T1": "EXISTENCE_ONLY"
  }
 },
 "execution_status": "SUCCESS",
 "failures": [
  {
   "message": "local discovery not applicable: no municipality in location_context",
   "stage": "local_discovery",
   "state": "RECOVERABLE"
  }
 ],
 "no_route_asserted": true,
 "presented_as_complete": true,
 "provenance": [
  {
   "authority_level": "LAW",
   "chain_parent_id": null,
   "claim_supported": "65 virkedagers maksimumsfrist for oppstart: MAKSIMUMSFRIST for naar nodvendig spesialisthelsetjeneste senest skal vaere paabegynt; den individuelle faglig forsvarlige fristen kan vaere kortere",
   "conflicts_with": [],
   "evidence_span": "65 virkedagers maksimumsfrist for oppstart: MAKSIMUMSFRIST for naar nodvendig spesialisthelsetjeneste senest skal vaere paabegynt; den individuelle faglig forsvarlige fristen kan vaere kortere",
   "freshness_class": "CURRENT",
   "id": "P-K001",
   "retrieved_at": null,
   "source_ref": "https://lovdata.no/dokument/SF/forskrift/2000-12-01-1208",
   "source_type": "FROZEN_RULE",
   "verified_at": "2026-09-09"
  },
  {
   "authority_level": "LAW",
   "chain_parent_id": null,
   "claim_supported": "10 virkedagers vurderingsfrist: frist for beslutning om pasienten har rett til nodvendig helsehjelp fra spesialisthelsetjenesten, og om eventual tidspunkt for tilbudet",
   "conflicts_with": [],
   "evidence_span": "10 virkedagers vurderingsfrist: frist for beslutning om pasienten har rett til nodvendig helsehjelp fra spesialisthelsetjenesten, og om eventual tidspunkt for tilbudet",
   "freshness_class": "CURRENT",
   "id": "P-K002",
   "retrieved_at": null,
   "source_ref": "https://lovdata.no/dokument/NL/lov/1999-07-02-63",
   "source_type": "FROZEN_RULE",
   "verified_at": "2026-09-09"
  },
  {
   "authority_level": "INTERNAL_DOC",
   "chain_parent_id": null,
   "claim_supported": "| BUP/PHBU | Nei som hovedregel (0-18 år). Ordinær overgang ved 18 år går til spesialisthelsetjenesten for voksne. Et pabegynt PHBU/BUP-forløp KAN etter konkret/individuell vurdering videreføres frem ",
   "conflicts_with": [],
   "evidence_span": "| BUP/PHBU | Nei som hovedregel (0-18 år). Ordinær overgang ved 18 år går til spesialisthelsetjenesten for voksne. Et pabegynt PHBU/BUP-forløp KAN etter konkret/individuell vurdering videreføres frem ",
   "freshness_class": "CURRENT",
   "id": "P-K003",
   "retrieved_at": null,
   "source_ref": "28b-18-20-aar-routing.md",
   "source_type": "PROJECT_RESEARCH",
   "verified_at": "2026-09-09"
  },
  {
   "authority_level": "INTERNAL_DOC",
   "chain_parent_id": null,
   "claim_supported": "- BUP BUK (Kvinne-barn-senteret): internt tilbud for innlagte og polikliniske barn 0-18 ar ved St. Olav; mottar kun henvisninger fra leger ved St. Olav; delansvar i lavterskeltilbudet for vold- og ove",
   "conflicts_with": [],
   "evidence_span": "- BUP BUK (Kvinne-barn-senteret): internt tilbud for innlagte og polikliniske barn 0-18 ar ved St. Olav; mottar kun henvisninger fra leger ved St. Olav; delansvar i lavterskeltilbudet for vold- og ove",
   "freshness_class": "POINT_IN_TIME",
   "id": "P-K004",
   "retrieved_at": null,
   "source_ref": "24-kildedokumentasjon-bup-og-habu.md",
   "source_type": "PROJECT_RESEARCH",
   "verified_at": "2026-09-09"
  },
  {
   "authority_level": "INTERNAL_DOC",
   "chain_parent_id": null,
   "claim_supported": "**Funn**: Beslutningsmatrisen i fil 26 dekker barn og unge 0-18 via BUP-ruten, men gir ikke en rad for unge 18-20 ar: over BUPs aldersgrense, innenfor HFUs (opptil 20 ar) og RPHs (over 16 ar) omfang, ",
   "conflicts_with": [],
   "evidence_span": "**Funn**: Beslutningsmatrisen i fil 26 dekker barn og unge 0-18 via BUP-ruten, men gir ikke en rad for unge 18-20 ar: over BUPs aldersgrense, innenfor HFUs (opptil 20 ar) og RPHs (over 16 ar) omfang, ",
   "freshness_class": "CURRENT",
   "id": "P-K005",
   "retrieved_at": null,
   "source_ref": "28c-beslutningsstotte-gaps.md",
   "source_type": "GAP",
   "verified_at": "2026-09-09"
  }
 ],
 "routes": [],
 "safety": {
  "priority": "NOT_ACUTE",
  "signals": [],
  "suppressed_routing": false
 },
 "safety_priority": "NOT_ACUTE",
 "tracks": [
  {
   "domain": "mental_health",
   "status": "RESOLVED",
   "track_id": "T1"
  }
 ],
 "uncertainty_expressed": [
  "no_route_found",
  "top_state_EXISTENCE_ONLY"
 ]
}