{
 "answer": "Nasjonal informasjon: 65 virkedagers maksimumsfrist for oppstart: MAKSIMUMSFRIST for naar nodvendig spesialisthelsetjeneste senest skal vaere paabegynt; den individuelle faglig forsvarlige fristen kan vaere kortere\n\nNasjonal informasjon: 10 virkedagers vurderingsfrist: frist for beslutning om pasienten har rett til nodvendig helsehjelp fra spesialisthelsetjenesten, og om eventual tidspunkt for tilbudet\n\nNasjonal informasjon: - Forholdsmessighet: forvaltningslovens opplysningsplikt og § 17-samarbeidet betyr at etaten skal innhente det som trengs for saken; ekstrem innhenting er ikke automatisk lovlig. Kommunen skal veilede i stedet for a blokkere nodhjelp bak papirkrav (nav.no: raskt svar i nodssituasjon).\n\nNasjonal informasjon: Regler bak ordlyden: aldri si «kommunen har ikke tilbud» naar kildene bare er ufullstendige; skill eksplisitt mellom verifisert lokal rute, lokal rute med uklar tilgang, fastlege-gateway og spesialist-gateway; og ikke behandle manglende HFU-aldersgrense over 20 som manglende tilbud for unge voksne, siden voksen-tilbudet (18+) ofte er ruten.\n\nNasjonal informasjon: - Helsedirektoratet, veileder-siden \"Kommunen skal sorge for psykisk helsetjeneste til barn og unge ...\": formularen \"Fastleger, psykologer og barnevernsledere har henvisningsrett\" bekreftet pa siden (helsedirektoratet.no, lest 08.09.2026). Skolehelsetjenesten staar oppfoert som samarbeidsaktor, ikke som henviser.\n\nFant ingen registrerte kommunale tilbud for denne henvendelsen. Det betyr ikke at tilbudet ikke finnes; det kan bety at oppslaget ikke dekker kommunen eller at soeket ikke ga treff.\n\nKilde P-K001: https://lovdata.no/dokument/SF/forskrift/2000-12-01-1208 (verifisert 2026-09-09)\nKilde P-K002: https://lovdata.no/dokument/NL/lov/1999-07-02-63 (verifisert 2026-09-09)\nKilde P-K003: 62-kildedokumentasjon-bostotte-okonomi-bolig.md (verifisert 2026-09-09)\nKilde P-K004: 72-18-23-aar-lokal-routing-klasse-4-6.md (verifisert 2026-09-09)\nKilde P-K005: 28c-beslutningsstotte-gaps.md (verifisert 2026-09-09)",
 "claims": [
  "65 virkedagers maksimumsfrist for oppstart: MAKSIMUMSFRIST for naar nodvendig spesialisthelsetjeneste senest skal vaere paabegynt; den individuelle faglig forsvarlige fristen kan vaere kortere",
  "10 virkedagers vurderingsfrist: frist for beslutning om pasienten har rett til nodvendig helsehjelp fra spesialisthelsetjenesten, og om eventual tidspunkt for tilbudet",
  "- Forholdsmessighet: forvaltningslovens opplysningsplikt og § 17-samarbeidet betyr at etaten skal innhente det som trengs for saken; ekstrem innhenting er ikke automatisk lovlig. Kommunen skal veilede i stedet for a blokkere nodhjelp bak papirkrav (nav.no: raskt svar i nodssituasjon).",
  "Regler bak ordlyden: aldri si «kommunen har ikke tilbud» når kildene bare er ufullstendige; skill eksplisitt mellom verifisert lokal rute, lokal rute med uklar tilgang, fastlege-gateway og spesialist-gateway; og ikke behandle manglende HFU-aldersgrense over 20 som manglende tilbud for unge voksne, siden voksen-tilbudet (18+) ofte er ruten.",
  "- Helsedirektoratet, veileder-siden \"Kommunen skal sorge for psykisk helsetjeneste til barn og unge ...\": formularen \"Fastleger, psykologer og barnevernsledere har henvisningsrett\" bekreftet pa siden (helsedirektoratet.no, lest 08.09.2026). Skolehelsetjenesten staar oppført som samarbeidsaktor, ikke som henviser."
 ],
 "epistemic_state": "EXISTENCE_ONLY",
 "evidence": {
  "conflicts": [],
  "per_track_epistemic": {
   "T1": "EXISTENCE_ONLY"
  }
 },
 "execution_status": "SUCCESS",
 "failures": [
  {
   "message": "local discovery not applicable: no municipality in location_context",
   "stage": "local_discovery",
   "state": "RECOVERABLE"
  }
 ],
 "no_route_asserted": true,
 "presented_as_complete": true,
 "provenance": [
  {
   "authority_level": "LAW",
   "chain_parent_id": null,
   "claim_supported": "65 virkedagers maksimumsfrist for oppstart: MAKSIMUMSFRIST for naar nodvendig spesialisthelsetjeneste senest skal vaere paabegynt; den individuelle faglig forsvarlige fristen kan vaere kortere",
   "conflicts_with": [],
   "evidence_span": "65 virkedagers maksimumsfrist for oppstart: MAKSIMUMSFRIST for naar nodvendig spesialisthelsetjeneste senest skal vaere paabegynt; den individuelle faglig forsvarlige fristen kan vaere kortere",
   "freshness_class": "CURRENT",
   "id": "P-K001",
   "retrieved_at": null,
   "source_ref": "https://lovdata.no/dokument/SF/forskrift/2000-12-01-1208",
   "source_type": "FROZEN_RULE",
   "verified_at": "2026-09-09"
  },
  {
   "authority_level": "LAW",
   "chain_parent_id": null,
   "claim_supported": "10 virkedagers vurderingsfrist: frist for beslutning om pasienten har rett til nodvendig helsehjelp fra spesialisthelsetjenesten, og om eventual tidspunkt for tilbudet",
   "conflicts_with": [],
   "evidence_span": "10 virkedagers vurderingsfrist: frist for beslutning om pasienten har rett til nodvendig helsehjelp fra spesialisthelsetjenesten, og om eventual tidspunkt for tilbudet",
   "freshness_class": "CURRENT",
   "id": "P-K002",
   "retrieved_at": null,
   "source_ref": "https://lovdata.no/dokument/NL/lov/1999-07-02-63",
   "source_type": "FROZEN_RULE",
   "verified_at": "2026-09-09"
  },
  {
   "authority_level": "INTERNAL_DOC",
   "chain_parent_id": null,
   "claim_supported": "- Forholdsmessighet: forvaltningslovens opplysningsplikt og § 17-samarbeidet betyr at etaten skal innhente det som trengs for saken; ekstrem innhenting er ikke automatisk lovlig. Kommunen skal veilede",
   "conflicts_with": [],
   "evidence_span": "- Forholdsmessighet: forvaltningslovens opplysningsplikt og § 17-samarbeidet betyr at etaten skal innhente det som trengs for saken; ekstrem innhenting er ikke automatisk lovlig. Kommunen skal veilede",
   "freshness_class": "POINT_IN_TIME",
   "id": "P-K003",
   "retrieved_at": null,
   "source_ref": "62-kildedokumentasjon-bostotte-okonomi-bolig.md",
   "source_type": "PROJECT_RESEARCH",
   "verified_at": "2026-09-09"
  },
  {
   "authority_level": "INTERNAL_DOC",
   "chain_parent_id": null,
   "claim_supported": "Regler bak ordlyden: aldri si «kommunen har ikke tilbud» når kildene bare er ufullstendige; skill eksplisitt mellom verifisert lokal rute, lokal rute med uklar tilgang, fastlege-gateway og spesialist-",
   "conflicts_with": [],
   "evidence_span": "Regler bak ordlyden: aldri si «kommunen har ikke tilbud» når kildene bare er ufullstendige; skill eksplisitt mellom verifisert lokal rute, lokal rute med uklar tilgang, fastlege-gateway og spesialist-",
   "freshness_class": "POINT_IN_TIME",
   "id": "P-K004",
   "retrieved_at": null,
   "source_ref": "72-18-23-aar-lokal-routing-klasse-4-6.md",
   "source_type": "PROJECT_RESEARCH",
   "verified_at": "2026-09-09"
  },
  {
   "authority_level": "INTERNAL_DOC",
   "chain_parent_id": null,
   "claim_supported": "- Helsedirektoratet, veileder-siden \"Kommunen skal sorge for psykisk helsetjeneste til barn og unge ...\": formularen \"Fastleger, psykologer og barnevernsledere har henvisningsrett\" bekreftet pa siden ",
   "conflicts_with": [],
   "evidence_span": "- Helsedirektoratet, veileder-siden \"Kommunen skal sorge for psykisk helsetjeneste til barn og unge ...\": formularen \"Fastleger, psykologer og barnevernsledere har henvisningsrett\" bekreftet pa siden ",
   "freshness_class": "CURRENT",
   "id": "P-K005",
   "retrieved_at": null,
   "source_ref": "28c-beslutningsstotte-gaps.md",
   "source_type": "GAP",
   "verified_at": "2026-09-09"
  }
 ],
 "routes": [],
 "safety": {
  "priority": "NOT_ACUTE",
  "signals": [],
  "suppressed_routing": false
 },
 "safety_priority": "NOT_ACUTE",
 "tracks": [
  {
   "domain": "mental_health",
   "status": "RESOLVED",
   "track_id": "T1"
  }
 ],
 "uncertainty_expressed": [
  "no_route_found",
  "top_state_EXISTENCE_ONLY"
 ]
}