{
 "answer": "Nasjonal informasjon: - Generelle NAV-regler gjelder (se 02-okonomiske-ytelser)\n\nNasjonal informasjon: - **Ansvar**: Kommunale lovpaalagte sosiale tjenester (sosialhjelp, raad/veiledning, midlertidig botilbud, individuell plan, KVP)\n\nNasjonal informasjon: | NAV familie/bidrag (fastsetting) | Fastsetter/endrer barnebidrag; behandler forskuddssoknad; barnetrygd-vedtak | Inkriverer ikke selv (utom forskuttering) |\n\nNasjonal informasjon: Status: verifisert mot nav.no/okonomisk-sosialhjelp (oppdatert 26.08.2026, lest 30.08.2026)\n\nNasjonal informasjon: 3. Foreldrene kan avtale belopet fritt (privat avtale). Kommer de ikke til enighet, kan minst en av dem be NAV fastsette bidraget.\n\nFant ingen registrerte kommunale tilbud for denne henvendelsen. Det betyr ikke at tilbudet ikke finnes; det kan bety at oppslaget ikke dekker kommunen eller at soeket ikke ga treff.\n\nKilde P-K001: 57-nodhjelp-og-akutte-situasjoner.md (verifisert 2026-09-09)\nKilde P-K002: 62-kildedokumentasjon-bostotte-okonomi-bolig.md (verifisert 2026-09-09)\nKilde P-K003: 55-bostotte-i-dybden.md (verifisert 2026-09-09)\nKilde P-K004: 56-okonomisk-sosialhjelp-i-dybden.md (verifisert 2026-09-09)\nKilde P-K005: 58-boligtrygghet-depositum-utkastelse.md (verifisert 2026-09-09)\nKilde P-K006: 52-mari-okonomisk-vurdering.md (verifisert 2026-09-09)\nKilde P-K007: 50-bidragsforskudd-og-innkreving.md (verifisert 2026-09-09)\nKilde P-K008: 51-familieokonomi-etter-samlivsbrudd.md (verifisert 2026-09-09)\nKilde P-K009: 56-okonomisk-sosialhjelp-i-dybden.md (verifisert 2026-09-09)\nKilde P-K010: 48-barnebidrag-i-dybden.md (verifisert 2026-09-09)\nKilde P-K011: 20-yrkesgrupper.md (verifisert 2026-09-09)\nKilde P-K012: 21-organisering-og-statistikk.md (verifisert 2026-09-09)",
 "claims": [],
 "epistemic_state": "UNVERIFIED",
 "evidence": {},
 "execution_status": "EXECUTION_FAILED",
 "failures": [
  {
   "message": "output consistency failed: verified claim value missing from answer",
   "stage": "input_normalization",
   "state": "TERMINAL"
  }
 ],
 "no_route_asserted": true,
 "presented_as_complete": false,
 "provenance": [],
 "routes": [],
 "safety": {
  "priority": "ACUTE_RISK_NOW",
  "signals": [],
  "suppressed_routing": true
 },
 "safety_priority": "ACUTE_RISK_NOW",
 "tracks": [],
 "uncertainty_expressed": []
}