{
 "answer": "Dette er en strukturert mellomlosning fra beslutningspipelinen (Phase 2). Endelig svartekst er ikke implementert ennaa. Ingen rute presentert som fullstendig verifisert; usikkerheter er listet nedenfor.",
 "claims": [
  "65 virkedagers maksimumsfrist for oppstart: MAKSIMUMSFRIST for naar nodvendig spesialisthelsetjeneste senest skal vaere paabegynt; den individuelle faglig forsvarlige fristen kan vaere kortere",
  "10 virkedagers vurderingsfrist: frist for beslutning om pasienten har rett til nodvendig helsehjelp fra spesialisthelsetjenesten, og om eventual tidspunkt for tilbudet",
  "**False-NO-MATCH-regel:** NAV Explore må aldri uttale «kommunen har ikke tilbud» fordi et første søk ga 0 treff. NO_LOCAL_MATCH er kun gyldig etter at discovery-protokollen er kjørt til en terminal state. Empirisk grunnlag: 18/20 problemceller ble gjenopprettet med full protokoll i foreldretasken, og 0 tilsynelatende service-gaps overlevde full protokoll i 12-kommuneutvalget.",
  "| F: gammel stønad utloper, sokter forlengelse | Overgangsregelverk: par. 1 bokstav d omfatter vedtak som kan utvides/forlenges etter gamle § 15-8 (FOR-1361 par. 1); overgangsfasen gar maksimalt til 30.6.2031 (par. 13) | Sok forlengelse; NAV legger overgangsreglene til grunn | 63, 68 |",
  "| Løsning | Premisset er borte: satsene er verifisert fra NAVs oppdaterte side. Fra 01.01.2026: 1 barn 4 895 kr/mnd (58 740/år), 2 barn 6 385 (76 620), 3+ 7 237 (86 844); 64 prosent dekning av dokumenterte utgifter; inntektsgrense 6 G = 819 294 kr; AAP, dagpenger, sykepenger m.m. teller i 6 G-vurderingen. Overført til fil 66 og r22 i data/familieokonomi-regler.json. |"
 ],
 "epistemic_state": "EXISTENCE_ONLY",
 "evidence": {
  "conflicts": [],
  "per_track_epistemic": {
   "T1": "EXISTENCE_ONLY"
  }
 },
 "execution_status": "SUCCESS",
 "failures": [
  {
   "message": "local discovery not applicable: no municipality in location_context",
   "stage": "local_discovery",
   "state": "RECOVERABLE"
  }
 ],
 "no_route_asserted": true,
 "presented_as_complete": false,
 "provenance": [
  {
   "authority_level": "LAW",
   "chain_parent_id": null,
   "claim_supported": "65 virkedagers maksimumsfrist for oppstart: MAKSIMUMSFRIST for naar nodvendig spesialisthelsetjeneste senest skal vaere paabegynt; den individuelle faglig forsvarlige fristen kan vaere kortere",
   "conflicts_with": [],
   "evidence_span": "65 virkedagers maksimumsfrist for oppstart: MAKSIMUMSFRIST for naar nodvendig spesialisthelsetjeneste senest skal vaere paabegynt; den individuelle faglig forsvarlige fristen kan vaere kortere",
   "freshness_class": "CURRENT",
   "id": "P-K001",
   "retrieved_at": null,
   "source_ref": "https://lovdata.no/dokument/SF/forskrift/2000-12-01-1208",
   "source_type": "FROZEN_RULE",
   "verified_at": "2026-09-09"
  },
  {
   "authority_level": "LAW",
   "chain_parent_id": null,
   "claim_supported": "10 virkedagers vurderingsfrist: frist for beslutning om pasienten har rett til nodvendig helsehjelp fra spesialisthelsetjenesten, og om eventual tidspunkt for tilbudet",
   "conflicts_with": [],
   "evidence_span": "10 virkedagers vurderingsfrist: frist for beslutning om pasienten har rett til nodvendig helsehjelp fra spesialisthelsetjenesten, og om eventual tidspunkt for tilbudet",
   "freshness_class": "CURRENT",
   "id": "P-K002",
   "retrieved_at": null,
   "source_ref": "https://lovdata.no/dokument/NL/lov/1999-07-02-63",
   "source_type": "FROZEN_RULE",
   "verified_at": "2026-09-09"
  },
  {
   "authority_level": "INTERNAL_DOC",
   "chain_parent_id": null,
   "claim_supported": "**False-NO-MATCH-regel:** NAV Explore må aldri uttale «kommunen har ikke tilbud» fordi et første søk ga 0 treff. NO_LOCAL_MATCH er kun gyldig etter at discovery-protokollen er kjørt til en terminal st",
   "conflicts_with": [],
   "evidence_span": "**False-NO-MATCH-regel:** NAV Explore må aldri uttale «kommunen har ikke tilbud» fordi et første søk ga 0 treff. NO_LOCAL_MATCH er kun gyldig etter at discovery-protokollen er kjørt til en terminal st",
   "freshness_class": "POINT_IN_TIME",
   "id": "P-K003",
   "retrieved_at": null,
   "source_ref": "73-lokal-tilgang-og-discovery-protokoll-v1.md",
   "source_type": "PROJECT_RESEARCH",
   "verified_at": "2026-09-09"
  },
  {
   "authority_level": "INTERNAL_DOC",
   "chain_parent_id": null,
   "claim_supported": "| F: gammel stønad utloper, sokter forlengelse | Overgangsregelverk: par. 1 bokstav d omfatter vedtak som kan utvides/forlenges etter gamle § 15-8 (FOR-1361 par. 1); overgangsfasen gar maksimalt til 3",
   "conflicts_with": [],
   "evidence_span": "| F: gammel stønad utloper, sokter forlengelse | Overgangsregelverk: par. 1 bokstav d omfatter vedtak som kan utvides/forlenges etter gamle § 15-8 (FOR-1361 par. 1); overgangsfasen gar maksimalt til 3",
   "freshness_class": "POINT_IN_TIME",
   "id": "P-K004",
   "retrieved_at": null,
   "source_ref": "00-BESLUTNINGSTRE.md",
   "source_type": "PROJECT_RESEARCH",
   "verified_at": "2026-09-09"
  },
  {
   "authority_level": "INTERNAL_DOC",
   "chain_parent_id": null,
   "claim_supported": "| Løsning | Premisset er borte: satsene er verifisert fra NAVs oppdaterte side. Fra 01.01.2026: 1 barn 4 895 kr/mnd (58 740/år), 2 barn 6 385 (76 620), 3+ 7 237 (86 844); 64 prosent dekning av dokumen",
   "conflicts_with": [],
   "evidence_span": "| Løsning | Premisset er borte: satsene er verifisert fra NAVs oppdaterte side. Fra 01.01.2026: 1 barn 4 895 kr/mnd (58 740/år), 2 barn 6 385 (76 620), 3+ 7 237 (86 844); 64 prosent dekning av dokumen",
   "freshness_class": "CURRENT",
   "id": "P-K005",
   "retrieved_at": null,
   "source_ref": "69-kunnskapshullregister.md",
   "source_type": "GAP",
   "verified_at": "2026-09-09"
  }
 ],
 "routes": [],
 "safety": {
  "priority": "NOT_ACUTE",
  "signals": [],
  "suppressed_routing": false
 },
 "safety_priority": "NOT_ACUTE",
 "tracks": [
  {
   "domain": "mental_health",
   "status": "NO_ROUTE",
   "track_id": "T1"
  }
 ],
 "uncertainty_expressed": [
  "answer_is_structured_placeholder"
 ]
}