{
 "answer": "Nasjonal informasjon: | Forventet inntekt | NAV beregner forventet inntekt framover fra opplysninger om arbeidsforhold og tidligere inntekt; tilbake i tid brukes faktisk inntekt |\n\nNasjonal informasjon: *Denne journalen er laget som en generell veiledning basert paa offentlig informasjon per 21.08.2026. Individuelle rettigheter og beloep avhenger av Mari's konkrete situasjon. Sjekk alltid nav.no og kontakt relevant fagpersonell for oppdatert og personlig veiledning.*\n\nNasjonal informasjon: *Denne analysen er laget som en generell veiledning. Individuelle vurderinger gjoeres av NAV/kommune. Sjekk alltid nav.no og kontakt relevant fagpersonell for oppdatert informasjon.*\n\nNasjonal informasjon: - Hvis dere ber NAV fastsette bidraget selv om dere har privat avtale, m dere sende avtalen til NAV for vedtak, og da betales gebyret. Gebyret gjelder kun hvis NAV fatter et vedtak, ikke hvis NAV bare oppretter en sak.\n\nNasjonal informasjon: **Status**: Sentralt register over kunnskapshull i overgangsstoenads-delen, oppdatert etter GAP-closure 30.08.2026 mot FOR-2026-06-25-1361 og primaerkilder (Lovdata, NAV, Husbanken, Skatteetaten). Registeret overstyrer de gamle hull-listene i fil 63-66 for punktene som er lukket. Ingen del er tilpasset konkrete vedtak.\n\nFant ingen registrerte kommunale tilbud for denne henvendelsen. Det betyr ikke at tilbudet ikke finnes; det kan bety at oppslaget ikke dekker kommunen eller at soeket ikke ga treff.\n\nKilde P-K001: 64-overgangsstonad-nye-regler-i-dybden.md (verifisert 2026-09-09)\nKilde P-K002: 22-personlig-journal-mari.md (verifisert 2026-09-09)\nKilde P-K003: 23-analyse-dokumentasjon-og-rekkefolge.md (verifisert 2026-09-09)\nKilde P-K004: 48-barnebidrag-i-dybden.md (verifisert 2026-09-09)\nKilde P-K005: 69-kunnskapshullregister.md (verifisert 2026-09-09)",
 "claims": [
  "| Forventet inntekt | NAV beregner forventet inntekt framover fra opplysninger om arbeidsforhold og tidligere inntekt; tilbake i tid brukes faktisk inntekt |",
  "*Denne journalen er laget som en generell veiledning basert på offentlig informasjon per 21.08.2026. Individuelle rettigheter og beløp avhenger av Mari's konkrete situasjon. Sjekk alltid nav.no og kontakt relevant fagpersonell for oppdatert og personlig veiledning.*",
  "*Denne analysen er laget som en generell veiledning. Individuelle vurderinger gjøres av NAV/kommune. Sjekk alltid nav.no og kontakt relevant fagpersonell for oppdatert informasjon.*",
  "- Hvis dere ber NAV fastsette bidraget selv om dere har privat avtale, m dere sende avtalen til NAV for vedtak, og da betales gebyret. Gebyret gjelder kun hvis NAV fatter et vedtak, ikke hvis NAV bare oppretter en sak.",
  "**Status**: Sentralt register over kunnskapshull i overgangsstønads-delen, oppdatert etter GAP-closure 30.08.2026 mot FOR-2026-06-25-1361 og primærkilder (Lovdata, NAV, Husbanken, Skatteetaten). Registeret overstyrer de gamle hull-listene i fil 63-66 for punktene som er lukket. Ingen del er tilpasset konkrete vedtak."
 ],
 "epistemic_state": "EXISTENCE_ONLY",
 "evidence": {
  "conflicts": [],
  "per_track_epistemic": {
   "T1": "EXISTENCE_ONLY"
  }
 },
 "execution_status": "SUCCESS",
 "failures": [
  {
   "message": "local discovery not applicable: no municipality in location_context",
   "stage": "local_discovery",
   "state": "RECOVERABLE"
  }
 ],
 "no_route_asserted": true,
 "presented_as_complete": true,
 "provenance": [
  {
   "authority_level": "INTERNAL_DOC",
   "chain_parent_id": null,
   "claim_supported": "| Forventet inntekt | NAV beregner forventet inntekt framover fra opplysninger om arbeidsforhold og tidligere inntekt; tilbake i tid brukes faktisk inntekt |",
   "conflicts_with": [],
   "evidence_span": "| Forventet inntekt | NAV beregner forventet inntekt framover fra opplysninger om arbeidsforhold og tidligere inntekt; tilbake i tid brukes faktisk inntekt |",
   "freshness_class": "POINT_IN_TIME",
   "id": "P-K001",
   "retrieved_at": null,
   "source_ref": "64-overgangsstonad-nye-regler-i-dybden.md",
   "source_type": "PROJECT_RESEARCH",
   "verified_at": "2026-09-09"
  },
  {
   "authority_level": "INTERNAL_DOC",
   "chain_parent_id": null,
   "claim_supported": "*Denne journalen er laget som en generell veiledning basert på offentlig informasjon per 21.08.2026. Individuelle rettigheter og beløp avhenger av Mari's konkrete situasjon. Sjekk alltid nav.no og kon",
   "conflicts_with": [],
   "evidence_span": "*Denne journalen er laget som en generell veiledning basert på offentlig informasjon per 21.08.2026. Individuelle rettigheter og beløp avhenger av Mari's konkrete situasjon. Sjekk alltid nav.no og kon",
   "freshness_class": "POINT_IN_TIME",
   "id": "P-K002",
   "retrieved_at": null,
   "source_ref": "22-personlig-journal-mari.md",
   "source_type": "PROJECT_RESEARCH",
   "verified_at": "2026-09-09"
  },
  {
   "authority_level": "INTERNAL_DOC",
   "chain_parent_id": null,
   "claim_supported": "*Denne analysen er laget som en generell veiledning. Individuelle vurderinger gjøres av NAV/kommune. Sjekk alltid nav.no og kontakt relevant fagpersonell for oppdatert informasjon.*",
   "conflicts_with": [],
   "evidence_span": "*Denne analysen er laget som en generell veiledning. Individuelle vurderinger gjøres av NAV/kommune. Sjekk alltid nav.no og kontakt relevant fagpersonell for oppdatert informasjon.*",
   "freshness_class": "POINT_IN_TIME",
   "id": "P-K003",
   "retrieved_at": null,
   "source_ref": "23-analyse-dokumentasjon-og-rekkefolge.md",
   "source_type": "PROJECT_RESEARCH",
   "verified_at": "2026-09-09"
  },
  {
   "authority_level": "INTERNAL_DOC",
   "chain_parent_id": null,
   "claim_supported": "- Hvis dere ber NAV fastsette bidraget selv om dere har privat avtale, m dere sende avtalen til NAV for vedtak, og da betales gebyret. Gebyret gjelder kun hvis NAV fatter et vedtak, ikke hvis NAV bare",
   "conflicts_with": [],
   "evidence_span": "- Hvis dere ber NAV fastsette bidraget selv om dere har privat avtale, m dere sende avtalen til NAV for vedtak, og da betales gebyret. Gebyret gjelder kun hvis NAV fatter et vedtak, ikke hvis NAV bare",
   "freshness_class": "POINT_IN_TIME",
   "id": "P-K004",
   "retrieved_at": null,
   "source_ref": "48-barnebidrag-i-dybden.md",
   "source_type": "PROJECT_RESEARCH",
   "verified_at": "2026-09-09"
  },
  {
   "authority_level": "INTERNAL_DOC",
   "chain_parent_id": null,
   "claim_supported": "**Status**: Sentralt register over kunnskapshull i overgangsstønads-delen, oppdatert etter GAP-closure 30.08.2026 mot FOR-2026-06-25-1361 og primærkilder (Lovdata, NAV, Husbanken, Skatteetaten). Regis",
   "conflicts_with": [],
   "evidence_span": "**Status**: Sentralt register over kunnskapshull i overgangsstønads-delen, oppdatert etter GAP-closure 30.08.2026 mot FOR-2026-06-25-1361 og primærkilder (Lovdata, NAV, Husbanken, Skatteetaten). Regis",
   "freshness_class": "CURRENT",
   "id": "P-K005",
   "retrieved_at": null,
   "source_ref": "69-kunnskapshullregister.md",
   "source_type": "GAP",
   "verified_at": "2026-09-09"
  }
 ],
 "routes": [],
 "safety": {
  "priority": "NOT_ACUTE",
  "signals": [],
  "suppressed_routing": false
 },
 "safety_priority": "NOT_ACUTE",
 "tracks": [
  {
   "domain": "general",
   "status": "RESOLVED",
   "track_id": "T1"
  }
 ],
 "uncertainty_expressed": [
  "no_route_found",
  "top_state_EXISTENCE_ONLY"
 ]
}