{
 "answer": "Dette er en strukturert mellomlosning fra beslutningspipelinen (Phase 2). Endelig svartekst er ikke implementert ennaa. Ingen rute presentert som fullstendig verifisert; usikkerheter er listet nedenfor.",
 "claims": [
  "65 virkedagers maksimumsfrist for oppstart: MAKSIMUMSFRIST for naar nodvendig spesialisthelsetjeneste senest skal vaere paabegynt; den individuelle faglig forsvarlige fristen kan vaere kortere",
  "10 virkedagers vurderingsfrist: frist for beslutning om pasienten har rett til nodvendig helsehjelp fra spesialisthelsetjenesten, og om eventual tidspunkt for tilbudet",
  "**Hensikt**: Praktisk kunnskapsgrunnlag for å avgjøre hvilken instans en familie bør kontakte i ulike situasjoner. Bygger på [25-kommunale-psykiske-tjenester-barn-unge](25-kommunale-psykiske-tjenester-barn-unge.md), [24-kildedokumentasjon-bup-og-habu](24-kildedokumentasjon-bup-og-habu.md) og [16-livssituasjoner/04-barns-psykiske-helse](16-livssituasjoner/04-barns-psykiske-helse.md).",
  "- Kontaktinformasjon for interkommunale RPH-tilbud (hvilket helseforetak, hvilken inngang).",
  "- Helsenorge, \"Psykisk helsehjelp for barn og unge\": \"Ta kontakt med skolehelsetjenesten, fastlegen eller den psykiske helsetjenesten i kommunen din\" + skolehelsetjenesten \"kan hjelpe deg med a kontakte fastlegen din hvis du trenger det\" (helsenorge.no, lest 08.09.2026). Ingen krav om at skolehelsetjenesten selv kan henvise til BUP."
 ],
 "epistemic_state": "EXISTENCE_ONLY",
 "evidence": {
  "conflicts": [],
  "per_track_epistemic": {
   "T1": "EXISTENCE_ONLY"
  }
 },
 "execution_status": "SUCCESS",
 "failures": [
  {
   "message": "local discovery not applicable: no municipality in location_context",
   "stage": "local_discovery",
   "state": "RECOVERABLE"
  }
 ],
 "no_route_asserted": true,
 "presented_as_complete": false,
 "provenance": [
  {
   "authority_level": "LAW",
   "chain_parent_id": null,
   "claim_supported": "65 virkedagers maksimumsfrist for oppstart: MAKSIMUMSFRIST for naar nodvendig spesialisthelsetjeneste senest skal vaere paabegynt; den individuelle faglig forsvarlige fristen kan vaere kortere",
   "conflicts_with": [],
   "evidence_span": "65 virkedagers maksimumsfrist for oppstart: MAKSIMUMSFRIST for naar nodvendig spesialisthelsetjeneste senest skal vaere paabegynt; den individuelle faglig forsvarlige fristen kan vaere kortere",
   "freshness_class": "CURRENT",
   "id": "P-K001",
   "retrieved_at": null,
   "source_ref": "https://lovdata.no/dokument/SF/forskrift/2000-12-01-1208",
   "source_type": "FROZEN_RULE",
   "verified_at": "2026-09-09"
  },
  {
   "authority_level": "LAW",
   "chain_parent_id": null,
   "claim_supported": "10 virkedagers vurderingsfrist: frist for beslutning om pasienten har rett til nodvendig helsehjelp fra spesialisthelsetjenesten, og om eventual tidspunkt for tilbudet",
   "conflicts_with": [],
   "evidence_span": "10 virkedagers vurderingsfrist: frist for beslutning om pasienten har rett til nodvendig helsehjelp fra spesialisthelsetjenesten, og om eventual tidspunkt for tilbudet",
   "freshness_class": "CURRENT",
   "id": "P-K002",
   "retrieved_at": null,
   "source_ref": "https://lovdata.no/dokument/NL/lov/1999-07-02-63",
   "source_type": "FROZEN_RULE",
   "verified_at": "2026-09-09"
  },
  {
   "authority_level": "INTERNAL_DOC",
   "chain_parent_id": null,
   "claim_supported": "**Hensikt**: Praktisk kunnskapsgrunnlag for å avgjøre hvilken instans en familie bør kontakte i ulike situasjoner. Bygger på [25-kommunale-psykiske-tjenester-barn-unge](25-kommunale-psykiske-tjenester",
   "conflicts_with": [],
   "evidence_span": "**Hensikt**: Praktisk kunnskapsgrunnlag for å avgjøre hvilken instans en familie bør kontakte i ulike situasjoner. Bygger på [25-kommunale-psykiske-tjenester-barn-unge](25-kommunale-psykiske-tjenester",
   "freshness_class": "CURRENT",
   "id": "P-K003",
   "retrieved_at": null,
   "source_ref": "26-beslutningsstotte-hvor-henvende-seg.md",
   "source_type": "PROJECT_RESEARCH",
   "verified_at": "2026-09-09"
  },
  {
   "authority_level": "INTERNAL_DOC",
   "chain_parent_id": null,
   "claim_supported": "- Kontaktinformasjon for interkommunale RPH-tilbud (hvilket helseforetak, hvilken inngang).",
   "conflicts_with": [],
   "evidence_span": "- Kontaktinformasjon for interkommunale RPH-tilbud (hvilket helseforetak, hvilken inngang).",
   "freshness_class": "POINT_IN_TIME",
   "id": "P-K004",
   "retrieved_at": null,
   "source_ref": "71-kommunekartlegging-psykisk-helse-sample-v1.md",
   "source_type": "PROJECT_RESEARCH",
   "verified_at": "2026-09-09"
  },
  {
   "authority_level": "INTERNAL_DOC",
   "chain_parent_id": null,
   "claim_supported": "- Helsenorge, \"Psykisk helsehjelp for barn og unge\": \"Ta kontakt med skolehelsetjenesten, fastlegen eller den psykiske helsetjenesten i kommunen din\" + skolehelsetjenesten \"kan hjelpe deg med a kontak",
   "conflicts_with": [],
   "evidence_span": "- Helsenorge, \"Psykisk helsehjelp for barn og unge\": \"Ta kontakt med skolehelsetjenesten, fastlegen eller den psykiske helsetjenesten i kommunen din\" + skolehelsetjenesten \"kan hjelpe deg med a kontak",
   "freshness_class": "CURRENT",
   "id": "P-K005",
   "retrieved_at": null,
   "source_ref": "28c-beslutningsstotte-gaps.md",
   "source_type": "GAP",
   "verified_at": "2026-09-09"
  }
 ],
 "routes": [],
 "safety": {
  "priority": "NOT_ACUTE",
  "signals": [],
  "suppressed_routing": false
 },
 "safety_priority": "NOT_ACUTE",
 "tracks": [
  {
   "domain": "mental_health",
   "status": "NO_ROUTE",
   "track_id": "T1"
  }
 ],
 "uncertainty_expressed": [
  "answer_is_structured_placeholder"
 ]
}