{
 "answer": "Dette er en strukturert mellomlosning fra beslutningspipelinen (Phase 2). Endelig svartekst er ikke implementert ennaa. Ingen rute presentert som fullstendig verifisert; usikkerheter er listet nedenfor.",
 "claims": [
  "- Ved fristbrudd: behandlingsstedet skal kontakte Helfo, som kan finne alternativt tilbud; man kan ogsa kontakte Helfo selv eller pasient- og brukerombudet.",
  "- 16-17 år: ungdommen er helserettslig myndig og samtykker selv til ordinær helsehjelp; foreldre kan involveres når ungdommen ønsker det.",
  "- Helsenorge HFU: fortsatt \"et gratis helsestasjonstilbud for ungdom (HFU) opptil 20 år\" og \"Du trenger ikke foreldrenes tillatelse for å kontakte HFU\" - HFU opptil 20 år uten foreldretillatelse, uendret.",
  "1. Du kan kontakte PPT selv for råd og veiledning, uten henvisning.",
  "**Funn**: Helsedirektoratets veileder \"Psykisk helsearbeid barn og unge\" navngir formal henvisningsrett til psykisk helsevern for barn og unge: \"Fastleger, psykologer og barnevernsledere har henvisningsrett\". Skolehelsetjenesten og helsestasjon for ungdom er ikke nevnt i henvisningsretten. Skolehelsetjenestens rolle er a stotte eleven og hjelpe til a kontakte fastlege eller kommunalt tilbud."
 ],
 "epistemic_state": "EXISTENCE_ONLY",
 "evidence": {
  "conflicts": [],
  "per_track_epistemic": {
   "T1": "EXISTENCE_ONLY"
  }
 },
 "execution_status": "SUCCESS",
 "failures": [
  {
   "message": "local discovery not applicable: no municipality in location_context",
   "stage": "local_discovery",
   "state": "RECOVERABLE"
  }
 ],
 "no_route_asserted": true,
 "presented_as_complete": false,
 "provenance": [
  {
   "authority_level": "INTERNAL_DOC",
   "chain_parent_id": null,
   "claim_supported": "- Ved fristbrudd: behandlingsstedet skal kontakte Helfo, som kan finne alternativt tilbud; man kan ogsa kontakte Helfo selv eller pasient- og brukerombudet.",
   "conflicts_with": [],
   "evidence_span": "- Ved fristbrudd: behandlingsstedet skal kontakte Helfo, som kan finne alternativt tilbud; man kan ogsa kontakte Helfo selv eller pasient- og brukerombudet.",
   "freshness_class": "POINT_IN_TIME",
   "id": "P-K001",
   "retrieved_at": null,
   "source_ref": "24-kildedokumentasjon-bup-og-habu.md",
   "source_type": "PROJECT_RESEARCH",
   "verified_at": "2026-09-09"
  },
  {
   "authority_level": "INTERNAL_DOC",
   "chain_parent_id": null,
   "claim_supported": "- 16-17 år: ungdommen er helserettslig myndig og samtykker selv til ordinær helsehjelp; foreldre kan involveres når ungdommen ønsker det.",
   "conflicts_with": [],
   "evidence_span": "- 16-17 år: ungdommen er helserettslig myndig og samtykker selv til ordinær helsehjelp; foreldre kan involveres når ungdommen ønsker det.",
   "freshness_class": "CURRENT",
   "id": "P-K002",
   "retrieved_at": null,
   "source_ref": "25-kommunale-psykiske-tjenester-barn-unge.md",
   "source_type": "PROJECT_RESEARCH",
   "verified_at": "2026-09-09"
  },
  {
   "authority_level": "INTERNAL_DOC",
   "chain_parent_id": null,
   "claim_supported": "- Helsenorge HFU: fortsatt \"et gratis helsestasjonstilbud for ungdom (HFU) opptil 20 år\" og \"Du trenger ikke foreldrenes tillatelse for å kontakte HFU\" - HFU opptil 20 år uten foreldretillatelse, uend",
   "conflicts_with": [],
   "evidence_span": "- Helsenorge HFU: fortsatt \"et gratis helsestasjonstilbud for ungdom (HFU) opptil 20 år\" og \"Du trenger ikke foreldrenes tillatelse for å kontakte HFU\" - HFU opptil 20 år uten foreldretillatelse, uend",
   "freshness_class": "POINT_IN_TIME",
   "id": "P-K003",
   "retrieved_at": null,
   "source_ref": "27-kildedokumentasjon-kommunale-tjenester-barn-unge.md",
   "source_type": "PROJECT_RESEARCH",
   "verified_at": "2026-09-09"
  },
  {
   "authority_level": "INTERNAL_DOC",
   "chain_parent_id": null,
   "claim_supported": "1. Du kan kontakte PPT selv for råd og veiledning, uten henvisning.",
   "conflicts_with": [],
   "evidence_span": "1. Du kan kontakte PPT selv for råd og veiledning, uten henvisning.",
   "freshness_class": "POINT_IN_TIME",
   "id": "P-K004",
   "retrieved_at": null,
   "source_ref": "28-ppt-i-dybden.md",
   "source_type": "PROJECT_RESEARCH",
   "verified_at": "2026-09-09"
  },
  {
   "authority_level": "INTERNAL_DOC",
   "chain_parent_id": null,
   "claim_supported": "**Funn**: Helsedirektoratets veileder \"Psykisk helsearbeid barn og unge\" navngir formal henvisningsrett til psykisk helsevern for barn og unge: \"Fastleger, psykologer og barnevernsledere har henvisnin",
   "conflicts_with": [],
   "evidence_span": "**Funn**: Helsedirektoratets veileder \"Psykisk helsearbeid barn og unge\" navngir formal henvisningsrett til psykisk helsevern for barn og unge: \"Fastleger, psykologer og barnevernsledere har henvisnin",
   "freshness_class": "CURRENT",
   "id": "P-K005",
   "retrieved_at": null,
   "source_ref": "28c-beslutningsstotte-gaps.md",
   "source_type": "GAP",
   "verified_at": "2026-09-09"
  }
 ],
 "routes": [],
 "safety": {
  "priority": "NOT_ACUTE",
  "signals": [],
  "suppressed_routing": false
 },
 "safety_priority": "NOT_ACUTE",
 "tracks": [
  {
   "domain": "general",
   "status": "NO_ROUTE",
   "track_id": "T1"
  }
 ],
 "uncertainty_expressed": [
  "answer_is_structured_placeholder"
 ]
}