{
 "answer": "Dette er en strukturert mellomlosning fra beslutningspipelinen (Phase 2). Endelig svartekst er ikke implementert ennaa. Ingen rute presentert som fullstendig verifisert; usikkerheter er listet nedenfor.",
 "claims": [
  "Dybdikartleggingen i fil 72 benyttet en trinnvis discovery-strategi som gjenopprettet 18/20 uklare rutingceller (90 %) i 12-kommuneutvalget. Etter den kartleggingen sto 9 konkrete tjenester igjen med `access_clear = no` eller partial: tjenestene var dokumentert som relevante, men den offentlige informasjonen viste ikke tydelig hvordan en innbygger faktisk kommer inn i tjenesten.",
  "Frosne discovery-protokoll V1 (`data/local-service-discovery-protocol-v1.json`) ble testet på helt nye kommuner for å avklare om den generaliserer, før eventuell crawler/runtime-implementering. Dette er en holdout-lignende generaliseringstest, ikke ny protokollutvikling. Ingen protokolldeler ble endret underveis (`PROTOCOL_MODIFICATIONS = 0`).",
  "- Fullt verifisert (HTTP 200). Henvisning: fra leger pa sykehus eller i kommunen, i samarbeid med foreldre; eget skjema (ovest til hoyre pa siden) er pakrevd; rehenvisning for barn allerede under oppfolging kan skje uten lege (fastlege far kopi).",
  "**Routing recovery rate: 18/20 = 90 %.** Av de 20 V1-problemscenariene ble 18 reklassifisert til VERIFIED_LOCAL_ROUTE etter dyp leting. Ni av ti V1-svikt var altså informasjons-/oppdagelseshull, ikke verifiserte tjenestehull.",
  "- Tilgangsverifisering av 9 gjenvaerende access-uklare tjenester (8/9 resolved) + discovery-protokoll V1: [73-lokal-tilgang-og-discovery-protokoll-v1](73-lokal-tilgang-og-discovery-protokoll-v1.md)"
 ],
 "epistemic_state": "EXISTENCE_ONLY",
 "evidence": {
  "conflicts": [],
  "per_track_epistemic": {
   "T1": "EXISTENCE_ONLY"
  }
 },
 "execution_status": "SUCCESS",
 "failures": [
  {
   "message": "local discovery not applicable: no municipality in location_context",
   "stage": "local_discovery",
   "state": "RECOVERABLE"
  }
 ],
 "no_route_asserted": true,
 "presented_as_complete": false,
 "provenance": [
  {
   "authority_level": "INTERNAL_DOC",
   "chain_parent_id": null,
   "claim_supported": "Dybdikartleggingen i fil 72 benyttet en trinnvis discovery-strategi som gjenopprettet 18/20 uklare rutingceller (90 %) i 12-kommuneutvalget. Etter den kartleggingen sto 9 konkrete tjenester igjen med ",
   "conflicts_with": [],
   "evidence_span": "Dybdikartleggingen i fil 72 benyttet en trinnvis discovery-strategi som gjenopprettet 18/20 uklare rutingceller (90 %) i 12-kommuneutvalget. Etter den kartleggingen sto 9 konkrete tjenester igjen med ",
   "freshness_class": "POINT_IN_TIME",
   "id": "P-K001",
   "retrieved_at": null,
   "source_ref": "73-lokal-tilgang-og-discovery-protokoll-v1.md",
   "source_type": "PROJECT_RESEARCH",
   "verified_at": "2026-09-09"
  },
  {
   "authority_level": "INTERNAL_DOC",
   "chain_parent_id": null,
   "claim_supported": "Frosne discovery-protokoll V1 (`data/local-service-discovery-protocol-v1.json`) ble testet på helt nye kommuner for å avklare om den generaliserer, før eventuell crawler/runtime-implementering. Dette ",
   "conflicts_with": [],
   "evidence_span": "Frosne discovery-protokoll V1 (`data/local-service-discovery-protocol-v1.json`) ble testet på helt nye kommuner for å avklare om den generaliserer, før eventuell crawler/runtime-implementering. Dette ",
   "freshness_class": "POINT_IN_TIME",
   "id": "P-K002",
   "retrieved_at": null,
   "source_ref": "74-lokal-discovery-generalisering-v1.md",
   "source_type": "PROJECT_RESEARCH",
   "verified_at": "2026-09-09"
  },
  {
   "authority_level": "INTERNAL_DOC",
   "chain_parent_id": null,
   "claim_supported": "- Fullt verifisert (HTTP 200). Henvisning: fra leger pa sykehus eller i kommunen, i samarbeid med foreldre; eget skjema (ovest til hoyre pa siden) er pakrevd; rehenvisning for barn allerede under oppf",
   "conflicts_with": [],
   "evidence_span": "- Fullt verifisert (HTTP 200). Henvisning: fra leger pa sykehus eller i kommunen, i samarbeid med foreldre; eget skjema (ovest til hoyre pa siden) er pakrevd; rehenvisning for barn allerede under oppf",
   "freshness_class": "POINT_IN_TIME",
   "id": "P-K003",
   "retrieved_at": null,
   "source_ref": "24-kildedokumentasjon-bup-og-habu.md",
   "source_type": "PROJECT_RESEARCH",
   "verified_at": "2026-09-09"
  },
  {
   "authority_level": "INTERNAL_DOC",
   "chain_parent_id": null,
   "claim_supported": "**Routing recovery rate: 18/20 = 90 %.** Av de 20 V1-problemscenariene ble 18 reklassifisert til VERIFIED_LOCAL_ROUTE etter dyp leting. Ni av ti V1-svikt var altså informasjons-/oppdagelseshull, ikke ",
   "conflicts_with": [],
   "evidence_span": "**Routing recovery rate: 18/20 = 90 %.** Av de 20 V1-problemscenariene ble 18 reklassifisert til VERIFIED_LOCAL_ROUTE etter dyp leting. Ni av ti V1-svikt var altså informasjons-/oppdagelseshull, ikke ",
   "freshness_class": "POINT_IN_TIME",
   "id": "P-K004",
   "retrieved_at": null,
   "source_ref": "72-18-23-aar-lokal-routing-klasse-4-6.md",
   "source_type": "PROJECT_RESEARCH",
   "verified_at": "2026-09-09"
  },
  {
   "authority_level": "INTERNAL_DOC",
   "chain_parent_id": null,
   "claim_supported": "- Tilgangsverifisering av 9 gjenvaerende access-uklare tjenester (8/9 resolved) + discovery-protokoll V1: [73-lokal-tilgang-og-discovery-protokoll-v1](73-lokal-tilgang-og-discovery-protokoll-v1.md)",
   "conflicts_with": [],
   "evidence_span": "- Tilgangsverifisering av 9 gjenvaerende access-uklare tjenester (8/9 resolved) + discovery-protokoll V1: [73-lokal-tilgang-og-discovery-protokoll-v1](73-lokal-tilgang-og-discovery-protokoll-v1.md)",
   "freshness_class": "CURRENT",
   "id": "P-K005",
   "retrieved_at": null,
   "source_ref": "28c-beslutningsstotte-gaps.md",
   "source_type": "GAP",
   "verified_at": "2026-09-09"
  }
 ],
 "routes": [],
 "safety": {
  "priority": "NOT_ACUTE",
  "signals": [],
  "suppressed_routing": false
 },
 "safety_priority": "NOT_ACUTE",
 "tracks": [
  {
   "domain": "legal_rights",
   "status": "NO_ROUTE",
   "track_id": "T1"
  }
 ],
 "uncertainty_expressed": [
  "answer_is_structured_placeholder"
 ]
}