{
 "answer": "Nasjonal informasjon: - Fordi bruddet skjedde etter 1.7.2026 og Mari soeker naa, foelger hun de nye reglene. Hun falt ikke inn i overgangsgruppen: FOR-1361 § 1 omfatter bare de som foer 1.7.2026 hadde vedtak, hadde soekt og fylt vilkaarene, fikk avslag omgjort med virkning foer 1.7.2026, eller kunne faa perioden forlenget (fil 68).\n\nNasjonal informasjon: - Skatt: mottatt barnebidrag er ikke skattepliktig inntekt for mottaker, og betaler far ikke fradrag (skatteloven §§ 5-42/5-43; Skatteetaten, verifisert 30.08.2026). Det er uavhengig av om bidraget inngar i behovsproving i andre ordninger (se fil 55 for bostotte og fil 56 for sosialhjelp).\n\nNasjonal informasjon: 1. Relevante ordninger: ordinaer barnetrygd (fortsetter), utvidet barnetrygd (soknad, alene om omsorgen), barnebidrag (privat avtale eller NAV-fastsetting), evt. bidragsforskudd ved manglende betaling, bostotte/overgangstonad avhengig av okonomi.\n\nNasjonal informasjon: Status: verifisert mot nav.no/okonomisk-sosialhjelp (oppdatert 26.08.2026, lest 30.08.2026)\n\nNasjonal informasjon: § 1 avgrenser hvem som omfattes (vedtak, soeknad, omgjort avslag, forlengelse), § 13 setter maksimal overgangsperiode til 30.\n\nFant ingen registrerte kommunale tilbud for denne henvendelsen. Det betyr ikke at tilbudet ikke finnes; det kan bety at oppslaget ikke dekker kommunen eller at soeket ikke ga treff.\n\nKilde P-K001: 57-nodhjelp-og-akutte-situasjoner.md (verifisert 2026-09-09)\nKilde P-K002: 62-kildedokumentasjon-bostotte-okonomi-bolig.md (verifisert 2026-09-09)\nKilde P-K003: 55-bostotte-i-dybden.md (verifisert 2026-09-09)\nKilde P-K004: 56-okonomisk-sosialhjelp-i-dybden.md (verifisert 2026-09-09)\nKilde P-K005: 58-boligtrygghet-depositum-utkastelse.md (verifisert 2026-09-09)\nKilde P-K006: 67-mari-overgangsstonad-vurdering.md (verifisert 2026-09-09)\nKilde P-K007: 48-barnebidrag-i-dybden.md (verifisert 2026-09-09)\nKilde P-K008: 52-mari-okonomisk-vurdering.md (verifisert 2026-09-09)\nKilde P-K009: 56-okonomisk-sosialhjelp-i-dybden.md (verifisert 2026-09-09)\nKilde P-K010: 63-overgangsstonad-endringsloven-og-kapittel-15.md (verifisert 2026-09-09)",
 "claims": [],
 "epistemic_state": "UNVERIFIED",
 "evidence": {},
 "execution_status": "EXECUTION_FAILED",
 "failures": [
  {
   "message": "output consistency failed: verified claim value missing from answer",
   "stage": "input_normalization",
   "state": "TERMINAL"
  }
 ],
 "no_route_asserted": true,
 "presented_as_complete": false,
 "provenance": [],
 "routes": [],
 "safety": {
  "priority": "ACUTE_RISK_NOW",
  "signals": [],
  "suppressed_routing": true
 },
 "safety_priority": "ACUTE_RISK_NOW",
 "tracks": [],
 "uncertainty_expressed": []
}